POLICY_ID,cloud_provider,service,check_name,check_description,Selected,Category,Code_Tfsec,Code_Checkov,,
POL01,azure,monitor,capture-all-activities,Ensure log profile captures all activities,TRUE,Logging/Monitoring,AVD-AZU-0033,CKV_AZURE_38,Not targeted by our study,
POL02,azure,network,disable-rdp-from-internet,"RDP access should not be accessible from the Internet, should be blocked on port 3389",TRUE,Access policy,AVD-AZU-0048,CKV_AZURE_9,,
POL03,azure,network,no-public-egress,An outbound network security rule allows traffic to /0.,TRUE,IP Address binding,AVD-AZU-0051,,,
POL04,azure,network,no-public-ingress,An inbound network security rule allows traffic from /0.,TRUE,IP Address binding,AVD-AZU-0047,,,
POL05,azure,network,ssh-blocked-from-internet,"SSH access should not be accessible from the Internet, should be blocked on port 22",TRUE,IP Address binding,AVD-AZU-0050,CKV_AZURE_10,,
POL06,azure,datafactory,no-public-access,"Data Factory should have public access disabled, the default is enabled.",TRUE,Access policy,AVD-AZU-0035,CKV_AZURE_104,,
POL07,azure,storage,enforce-https,Storage accounts should be configured to only accept transfers that are over secure connections,TRUE,Encryption in transit,AVD-AZU-0008,CKV2_AZURE_33,Not targeted by our study,
POL08,azure,storage,no-public-access,Storage containers in blob storage mode should not have public access,TRUE,Access policy,AVD-AZU-0007,CKV2_AZURE_8,,
POL09,azure,storage,queue-services-logging-enabled,"When using Queue Services for a storage account, logging should be enabled.",TRUE,Logging/Monitoring,AVD-AZU-0009,CKV_AZURE_33,,
POL10,azure,storage,use-secure-tls-policy,The minimum TLS version for Storage Accounts should be TLS1_2,TRUE,Encryption in transit,AVD-AZU-0011,CKV_AZURE_44,,
POL11,azure,authorization,limit-role-actions,Roles limited to the required actions,TRUE,Admin by default,AVD-AZU-0030,CKV_AZURE_39,Not targeted by our study,
POL12,azure,keyvault,specify-network-acl,Key vault should have the network acl block specified,TRUE,Access policy,AVD-AZU-0013,CKV_AZURE_189,,
POL13,azure,container,configured-network-policy,Ensure AKS cluster has Network Policy configured,TRUE,Access policy,AVD-AZU-0043,CKV_AZURE_7,Not targeted by our study,
POL14,azure,container,limit-authorized-ips,Ensure AKS has an API Server Authorized IP Ranges enabled,TRUE,IP Address binding,AVD-AZU-0041,CKV_AZURE_6,Not targeted by our study,
POL15,azure,container,logging,Ensure AKS logging to Azure Monitoring is Configured,TRUE,Logging/Monitoring,AVD-AZU-0040,CKV_AZURE_4,,
POL16,azure,container,use-rbac-permissions,Ensure RBAC is enabled on AKS clusters,TRUE,Access policy,AVD-AZU-0042,CKV_AZURE_5,,
POL17,azure,appservice,account-identity-registered,Web App has registration with AD enabled,TRUE,Access policy,AVD-AZU-0002,,,
POL18,azure,appservice,authentication-enabled,App Service authentication is activated,TRUE,Access policy,AVD-AZU-0003,CKV_AZURE_13,Not targeted by our study,
POL19,azure,appservice,enable-http2,Web App uses the latest HTTP version,TRUE,Outdated feature,AVD-AZU-0005,CKV_AZURE_18,,
POL20,azure,appservice,enforce-https,Ensure the Function App can only be accessed via HTTPS. The default is false.,TRUE,Encryption in transit,AVD-AZU-0004,CKV_AZURE_70,,
POL21,azure,appservice,require-client-cert,Web App accepts incoming client certificate,TRUE,Encryption in transit,AVD-AZU-0001,CKV_AZURE_17,Not targeted by our study,
POL22,azure,appservice,use-secure-tls-policy,Web App uses latest TLS version,TRUE,Encryption in transit,AVD-AZU-0006,CKV_AZURE_15,,
POL23,azure,compute,disable-password-authentication,Password authentication should be disabled on Azure virtual machines,TRUE,Access policy,AVD-AZU-0039,CKV_AZURE_149,Not targeted by our study,
POL24,azure,compute,enable-disk-encryption,Enable disk encryption on managed disk,TRUE,Encryption at rest,AVD-AZU-0038,CKV_AZURE_2,,
POL25,azure,compute,no-secrets-in-custom-data,Ensure that no sensitive credentials are exposed in VM custom_data,TRUE,Hard-coded secret,AVD-AZU-0037,CKV_AZURE_45,,
POL26,azure,datalake,enable-at-rest-encryption,Unencrypted data lake storage.,TRUE,Encryption at rest,AVD-AZU-0036,CKV_AZURE_105,,
POL27,azure,database,all-threat-alerts-enabled,No threat detections are set,TRUE,Logging/Monitoring,AVD-AZU-0028,CKV_AZURE_25,Not targeted by our study,
POL28,azure,database,enable-audit,Auditing should be enabled on Azure SQL Databases,TRUE,Logging/Monitoring,AVD-AZU-0027,,,
POL29,azure,database,enable-ssl-enforcement,SSL should be enforced on database connections where applicable,TRUE,Encryption in transit,AVD-AZU-0020,CKV_AZURE_28,Not targeted by our study,
POL30,azure,database,enable-ssl-enforcement,SSL should be enforced on database connections where applicable,TRUE,Encryption in transit,AVD-AZU-0020,CKV_AZURE_29,Not targeted by our study,
POL31,azure,database,enable-ssl-enforcement,SSL should be enforced on database connections where applicable,TRUE,Encryption in transit,AVD-AZU-0020,CKV_AZURE_47,Not targeted by our study,
POL32,azure,database,no-public-access,Ensure databases are not publicly accessible,TRUE,Access policy,AVD-AZU-0022,CKV_AZURE_11,,
POL33,azure,database,no-public-firewall-access,Ensure database firewalls do not permit public access,TRUE,Access policy,AVD-AZU-0029,CKV_AZURE_220,Not targeted by our study,
POL34,azure,database,postgres-configuration-log-checkpoints,Ensure server parameter 'log_checkpoints' is set to 'ON' for PostgreSQL Database Server,TRUE,Logging/Monitoring,AVD-AZU-0024,CKV_AZURE_30,,
POL35,azure,database,postgres-configuration-log-connections,Ensure server parameter 'log_connections' is set to 'ON' for PostgreSQL Database Server,TRUE,Logging/Monitoring,AVD-AZU-0019,CKV_AZURE_31,,
POL36,azure,database,secure-tls-policy,Databases should have the minimum TLS set for connections,TRUE,Encryption in transit,AVD-AZU-0026,"CKV_AZURE_54, CKV_AZURE_52, ",,
