Id,Type,Entity,Policy,IaC,Selected,Category
1309,CKV_AZURE_189,resource,azurerm_key_vault,Ensure that Azure Key Vault disables public network access,FALSE,
1310,CKV_AZURE_190,resource,azurerm_storage_account,Ensure that Storage blobs restrict public access,FALSE,
1311,CKV_AZURE_191,resource,azurerm_eventgrid_topic,Ensure that Managed identity provider is enabled for Azure Event Grid Topic,FALSE,
1312,CKV_AZURE_192,resource,azurerm_eventgrid_topic,Ensure that Azure Event Grid Topic local Authentication is disabled,FALSE,
1313,CKV_AZURE_193,resource,azurerm_eventgrid_topic,Ensure public network access is disabled for Azure Event Grid Topic,FALSE,
1314,CKV_AZURE_194,resource,azurerm_eventgrid_domain,Ensure that Managed identity provider is enabled for Azure Event Grid Domain,FALSE,
1315,CKV_AZURE_195,resource,azurerm_eventgrid_domain,Ensure that Azure Event Grid Domain local Authentication is disabled,FALSE,
1316,CKV_AZURE_196,resource,azurerm_signalr_service,Ensure that SignalR uses a Paid Sku for its SLA,FALSE,
1319,CKV_AZURE_199,resource,azurerm_servicebus_namespace,Ensure that Azure Service Bus uses double encryption,FALSE,
1321,CKV_AZURE_201,resource,azurerm_servicebus_namespace,Ensure that Azure Service Bus uses a customer-managed key to encrypt data,FALSE,
1322,CKV_AZURE_202,resource,azurerm_servicebus_namespace,Ensure that Managed identity provider is enabled for Azure Service Bus,FALSE,
1323,CKV_AZURE_203,resource,azurerm_servicebus_namespace,Ensure Azure Service Bus Local Authentication is disabled,FALSE,
1326,CKV_AZURE_206,resource,azurerm_storage_account,Ensure that Storage Accounts use replication,FALSE,
1327,CKV_AZURE_207,resource,azurerm_search_service,Ensure Azure Cognitive Search service uses managed identities to access Azure resources,FALSE,
1328,CKV_AZURE_208,resource,azurerm_search_service,Ensure that Azure Cognitive Search maintains SLA for index updates,FALSE,
1329,CKV_AZURE_209,resource,azurerm_search_service,Ensure that Azure Cognitive Search maintains SLA for search index queries,FALSE,
1330,CKV_AZURE_210,resource,azurerm_search_service,Ensure Azure Cognitive Search service allowed IPS does not give public Access,FALSE,
1331,CKV_AZURE_211,resource,azurerm_service_plan,Ensure App Service plan suitable for production use,FALSE,
1332,CKV_AZURE_212,resource,azurerm_service_plan,Ensure App Service has a minimum number of instances for failover,FALSE,
1333,CKV_AZURE_213,resource,azurerm_app_service,Ensure that App Service configures health check,FALSE,
1336,CKV_AZURE_214,resource,azurerm_linux_web_app,Ensure App Service is set to be always on,FALSE,
1339,CKV2_AZURE_2,resource,azurerm_mssql_server_security_alert_policy,Ensure that Vulnerability Assessment (VA) is enabled on a SQL server by setting a Storage Account,FALSE,
1341,CKV2_AZURE_3,resource,azurerm_mssql_server,Ensure that VA setting Periodic Recurring Scans is enabled on a SQL server,FALSE,
1345,CKV2_AZURE_4,resource,azurerm_mssql_server,Ensure Azure SQL server ADS VA Send scan reports to is configured,FALSE,
1349,CKV2_AZURE_5,resource,azurerm_mssql_server,Ensure that VA setting 'Also send email notifications to admins and subscription owners' is set for a SQL server,FALSE,
1355,CKV2_AZURE_7,resource,azurerm_sql_server,Ensure that Azure Active Directory Admin is configured,FALSE,
1359,CKV2_AZURE_9,resource,azurerm_virtual_machine,Ensure Virtual Machines are utilizing Managed Disks,FALSE,
1360,CKV2_AZURE_10,resource,azurerm_virtual_machine,Ensure that Microsoft Antimalware is configured to automatically updates for Virtual Machines,FALSE,
1362,CKV2_AZURE_11,resource,azurerm_kusto_cluster,Ensure that Azure Data Explorer encryption at rest uses a customer-managed key,FALSE,
1363,CKV2_AZURE_12,resource,azurerm_virtual_machine,Ensure that virtual machines are backed up using Azure Backup,FALSE,
1364,CKV2_AZURE_13,resource,azurerm_mssql_server_security_alert_policy,Ensure that sql servers enables data security policy,FALSE,
1375,CKV2_AZURE_19,resource,azurerm_synapse_workspace,Ensure that Azure Synapse workspaces have no IP firewall rules attached,FALSE,
1382,CKV2_AZURE_22,resource,azurerm_cognitive_account,Ensure that Cognitive Services enables customer-managed key for encryption,FALSE,